{
  "schema": "mva.track1-reference-ledger/v1",
  "ledger_id": "track1-public-reference-lock",
  "champion_public_only": true,
  "resources": [
    {
      "resource_id": "synthetic-reference-v1",
      "name": "Synthetic public reference fixture",
      "source_scope": "public",
      "release": "fixture-2026.08",
      "release_date": "2026-08-01",
      "retrieved_at_utc": "2026-08-26T15:00:00+00:00",
      "source_url": "https://example.org/reference/fixture-2026.08",
      "license_id": "CC0-1.0",
      "license_url": "https://creativecommons.org/publicdomain/zero/1.0/",
      "sha256": "aaaaaaaaaaaaaaaaaaaaaaaaaaaaaaaaaaaaaaaaaaaaaaaaaaaaaaaaaaaaaaaa",
      "immutable_revision": null,
      "purpose": "Exercise deterministic public-reference ledger validation.",
      "use_mode": "local_offline",
      "hosted_api_used": false,
      "challenge_controlled": false,
      "model_slots": ["S1", "S2"],
      "redistribution_notes": "Synthetic fixture may be redistributed with this project.",
      "attribution_notes": "Attribute the synthetic fixture definition to this project."
    }
  ]
}
